{
  "schemaVersion": "1.0",
  "templateId": "six-panel-a4-v1",
  "page": { "size": "A4", "orientation": "portrait", "width": 794, "height": 1123 },
  "theme": {
    "fontFamily": "Noto Sans JP, Yu Gothic, sans-serif",
    "primaryColor": "#2457A7",
    "emphasisColor": "#D94141"
  },
  "exports": ["html", "pdf"]
}
